<?xml version="1.0" encoding="UTF-8"?>
<!DOCTYPE keyboard SYSTEM "../dtd/ldmlKeyboard.dtd">
<keyboard locale="lv-t-k0-windows-qwerty">
	<version platform="10" number="$Revision$"/>
	<names>
		<name value="Latvian (QWERTY)"/>
	</names>
	<settings fallback="omit" transformPartial="hide"/>
	<keyMap>
		<map iso="E00" to="`"/>
		<map iso="E01" to="1"/>
		<map iso="E02" to="2"/>
		<map iso="E03" to="3"/>
		<map iso="E04" to="4"/>
		<map iso="E05" to="5"/>
		<map iso="E06" to="6"/>
		<map iso="E07" to="7"/>
		<map iso="E08" to="8"/>
		<map iso="E09" to="9"/>
		<map iso="E10" to="0"/>
		<map iso="E11" to="-"/>
		<map iso="E12" to="="/>
		<map iso="D01" to="q"/>
		<map iso="D02" to="w"/>
		<map iso="D03" to="e"/>
		<map iso="D04" to="r"/>
		<map iso="D05" to="t"/>
		<map iso="D06" to="y"/>
		<map iso="D07" to="u"/>
		<map iso="D08" to="i"/>
		<map iso="D09" to="o"/>
		<map iso="D10" to="p"/>
		<map iso="D11" to="["/>
		<map iso="D12" to="]"/>
		<map iso="C01" to="a"/>
		<map iso="C02" to="s"/>
		<map iso="C03" to="d"/>
		<map iso="C04" to="f"/>
		<map iso="C05" to="g"/>
		<map iso="C06" to="h"/>
		<map iso="C07" to="j"/>
		<map iso="C08" to="k"/>
		<map iso="C09" to="l"/>
		<map iso="C10" to=";"/>
		<map iso="C11" to="&apos;"/>
		<map iso="C12" to="°"/> <!-- (key to right of ') -->
		<map iso="B00" to="\"/> <!-- (key to left of Z) -->
		<map iso="B01" to="z"/>
		<map iso="B02" to="x"/>
		<map iso="B03" to="c"/>
		<map iso="B04" to="v"/>
		<map iso="B05" to="b"/>
		<map iso="B06" to="n"/>
		<map iso="B07" to="m"/>
		<map iso="B08" to=","/>
		<map iso="B09" to="."/>
		<map iso="B10" to="/"/>
		<map iso="A03" to=" "/> <!-- space -->
	</keyMap>
	<keyMap modifiers="shift">
		<map iso="E00" to="~"/> <!-- ` -->
		<map iso="E01" to="!"/> <!-- 1 -->
		<map iso="E02" to="@"/> <!-- 2 -->
		<map iso="E03" to="#"/> <!-- 3 -->
		<map iso="E04" to="$"/> <!-- 4 -->
		<map iso="E05" to="%"/> <!-- 5 -->
		<map iso="E06" to="^"/> <!-- 6 -->
		<map iso="E07" to="&amp;"/> <!-- 7 -->
		<map iso="E08" to="*"/> <!-- 8 -->
		<map iso="E09" to="("/> <!-- 9 -->
		<map iso="E10" to=")"/> <!-- 0 -->
		<map iso="E11" to="_"/> <!-- - -->
		<map iso="E12" to="+"/> <!-- = -->
		<map iso="D01" to="Q"/>
		<map iso="D02" to="W"/>
		<map iso="D03" to="E"/>
		<map iso="D04" to="R"/>
		<map iso="D05" to="T"/>
		<map iso="D06" to="Y"/>
		<map iso="D07" to="U"/>
		<map iso="D08" to="I"/>
		<map iso="D09" to="O"/>
		<map iso="D10" to="P"/>
		<map iso="D11" to="{"/> <!-- [ -->
		<map iso="D12" to="}"/> <!-- ] -->
		<map iso="C01" to="A"/>
		<map iso="C02" to="S"/>
		<map iso="C03" to="D"/>
		<map iso="C04" to="F"/>
		<map iso="C05" to="G"/>
		<map iso="C06" to="H"/>
		<map iso="C07" to="J"/>
		<map iso="C08" to="K"/>
		<map iso="C09" to="L"/>
		<map iso="C10" to=":"/> <!-- ; -->
		<map iso="C11" to="\u{22}"/> <!-- '  to= "  -->
		<map iso="C12" to="|"/> <!-- (key to right of ')  base=° -->
		<map iso="B00" to="|"/> <!-- (key to left of Z)  base=\ -->
		<map iso="B01" to="Z"/>
		<map iso="B02" to="X"/>
		<map iso="B03" to="C"/>
		<map iso="B04" to="V"/>
		<map iso="B05" to="B"/>
		<map iso="B06" to="N"/>
		<map iso="B07" to="M"/>
		<map iso="B08" to="&lt;"/> <!-- , -->
		<map iso="B09" to="&gt;"/> <!-- . -->
		<map iso="B10" to="?"/> <!-- / -->
		<map iso="A03" to=" "/> <!-- space -->
	</keyMap>
	<keyMap modifiers="caps">
		<map iso="E00" to="`"/>
		<map iso="E01" to="1"/>
		<map iso="E02" to="2"/>
		<map iso="E03" to="3"/>
		<map iso="E04" to="4"/>
		<map iso="E05" to="5"/>
		<map iso="E06" to="6"/>
		<map iso="E07" to="7"/>
		<map iso="E08" to="8"/>
		<map iso="E09" to="9"/>
		<map iso="E10" to="0"/>
		<map iso="E11" to="-"/>
		<map iso="E12" to="="/>
		<map iso="D01" to="Q"/>
		<map iso="D02" to="W"/>
		<map iso="D03" to="E"/>
		<map iso="D04" to="R"/>
		<map iso="D05" to="T"/>
		<map iso="D06" to="Y"/>
		<map iso="D07" to="U"/>
		<map iso="D08" to="I"/>
		<map iso="D09" to="O"/>
		<map iso="D10" to="P"/>
		<map iso="D11" to="["/>
		<map iso="D12" to="]"/>
		<map iso="C01" to="A"/>
		<map iso="C02" to="S"/>
		<map iso="C03" to="D"/>
		<map iso="C04" to="F"/>
		<map iso="C05" to="G"/>
		<map iso="C06" to="H"/>
		<map iso="C07" to="J"/>
		<map iso="C08" to="K"/>
		<map iso="C09" to="L"/>
		<map iso="C10" to=";"/>
		<map iso="C11" to="&apos;"/>
		<map iso="C12" to="°"/> <!-- (key to right of ') -->
		<map iso="B00" to="\"/> <!-- (key to left of Z) -->
		<map iso="B01" to="Z"/>
		<map iso="B02" to="X"/>
		<map iso="B03" to="C"/>
		<map iso="B04" to="V"/>
		<map iso="B05" to="B"/>
		<map iso="B06" to="N"/>
		<map iso="B07" to="M"/>
		<map iso="B08" to=","/>
		<map iso="B09" to="."/>
		<map iso="B10" to="/"/>
		<map iso="A03" to=" "/> <!-- space -->
	</keyMap>
	<keyMap modifiers="caps+shift">
		<map iso="E00" to="~"/> <!-- ` -->
		<map iso="E01" to="!"/> <!-- 1 -->
		<map iso="E02" to="@"/> <!-- 2 -->
		<map iso="E03" to="#"/> <!-- 3 -->
		<map iso="E04" to="$"/> <!-- 4 -->
		<map iso="E05" to="%"/> <!-- 5 -->
		<map iso="E06" to="^"/> <!-- 6 -->
		<map iso="E07" to="&amp;"/> <!-- 7 -->
		<map iso="E08" to="*"/> <!-- 8 -->
		<map iso="E09" to="("/> <!-- 9 -->
		<map iso="E10" to=")"/> <!-- 0 -->
		<map iso="E11" to="_"/> <!-- - -->
		<map iso="E12" to="+"/> <!-- = -->
		<map iso="D01" to="q"/>
		<map iso="D02" to="w"/>
		<map iso="D03" to="e"/>
		<map iso="D04" to="r"/>
		<map iso="D05" to="t"/>
		<map iso="D06" to="y"/>
		<map iso="D07" to="u"/>
		<map iso="D08" to="i"/>
		<map iso="D09" to="o"/>
		<map iso="D10" to="p"/>
		<map iso="D11" to="{"/> <!-- [ -->
		<map iso="D12" to="}"/> <!-- ] -->
		<map iso="C01" to="a"/>
		<map iso="C02" to="s"/>
		<map iso="C03" to="d"/>
		<map iso="C04" to="f"/>
		<map iso="C05" to="g"/>
		<map iso="C06" to="h"/>
		<map iso="C07" to="j"/>
		<map iso="C08" to="k"/>
		<map iso="C09" to="l"/>
		<map iso="C10" to=":"/> <!-- ; -->
		<map iso="C11" to="\u{22}"/> <!-- '  to= "  -->
		<map iso="C12" to="|"/> <!-- (key to right of ')  base=° -->
		<map iso="B00" to="|"/> <!-- (key to left of Z)  base=\ -->
		<map iso="B01" to="z"/>
		<map iso="B02" to="x"/>
		<map iso="B03" to="c"/>
		<map iso="B04" to="v"/>
		<map iso="B05" to="b"/>
		<map iso="B06" to="n"/>
		<map iso="B07" to="m"/>
		<map iso="B08" to="&lt;"/> <!-- , -->
		<map iso="B09" to="&gt;"/> <!-- . -->
		<map iso="B10" to="?"/> <!-- / -->
		<map iso="A03" to=" "/> <!-- space -->
	</keyMap>
	<keyMap modifiers="altR+caps? ctrl+alt+caps?">
		<map iso="E00" to="\u{AD}"/> <!-- ` -->
		<map iso="E01" to="\u{A0}"/> <!-- 1 -->
		<map iso="E02" to="«"/> <!-- 2 -->
		<map iso="E03" to="»"/> <!-- 3 -->
		<map iso="E04" to="€"/> <!-- 4 -->
		<map iso="E06" to="’"/> <!-- 6 -->
		<map iso="E11" to="–"/> <!-- - -->
		<map iso="D03" to="ē"/> <!-- E -->
		<map iso="D04" to="ŗ"/> <!-- R -->
		<map iso="D07" to="ū"/> <!-- U -->
		<map iso="D08" to="ī"/> <!-- I -->
		<map iso="D09" to="õ"/> <!-- O -->
		<map iso="C01" to="ā"/> <!-- A -->
		<map iso="C02" to="š"/> <!-- S -->
		<map iso="C05" to="ģ"/> <!-- G -->
		<map iso="C08" to="ķ"/> <!-- K -->
		<map iso="C09" to="ļ"/> <!-- L -->
		<map iso="C11" to="´"/> <!-- ' -->
		<map iso="B01" to="ž"/> <!-- Z -->
		<map iso="B03" to="č"/> <!-- C -->
		<map iso="B06" to="ņ"/> <!-- N -->
	</keyMap>
	<keyMap modifiers="altR+shift+caps? ctrl+alt+shift+caps?">
		<map iso="E04" to="§"/> <!-- 4 -->
		<map iso="E05" to="°" transform="no"/> <!-- 5 -->
		<map iso="E07" to="±"/> <!-- 7 -->
		<map iso="E08" to="×"/> <!-- 8 -->
		<map iso="E11" to="—"/> <!-- - -->
		<map iso="D03" to="Ē"/> <!-- E -->
		<map iso="D04" to="Ŗ"/> <!-- R -->
		<map iso="D07" to="Ū"/> <!-- U -->
		<map iso="D08" to="Ī"/> <!-- I -->
		<map iso="D09" to="Õ"/> <!-- O -->
		<map iso="C01" to="Ā"/> <!-- A -->
		<map iso="C02" to="Š"/> <!-- S -->
		<map iso="C05" to="Ģ"/> <!-- G -->
		<map iso="C08" to="Ķ"/> <!-- K -->
		<map iso="C09" to="Ļ"/> <!-- L -->
		<map iso="C11" to="¨"/> <!-- ' -->
		<map iso="B01" to="Ž"/> <!-- Z -->
		<map iso="B03" to="Č"/> <!-- C -->
		<map iso="B06" to="Ņ"/> <!-- N -->
	</keyMap>
	<keyMap modifiers="ctrl+caps?">
		<map iso="D11" to="\u{1B}"/> <!-- [ -->
		<map iso="D12" to="\u{1D}"/> <!-- ] -->
		<map iso="C12" to="\u{1C}"/> <!-- (key to right of ')  base=° -->
		<map iso="B00" to="\u{1C}"/> <!-- (key to left of Z)  base=\ -->
		<map iso="A03" to=" "/> <!-- space -->
	</keyMap>
	<transforms type="simple">
		<transform from="´ " to="´"/>
		<transform from="´c" to="ć"/>
		<transform from="´C" to="Ć"/>
		<transform from="´e" to="é"/>
		<transform from="´E" to="É"/>
		<transform from="´n" to="ń"/>
		<transform from="´N" to="Ń"/>
		<transform from="´o" to="ó"/>
		<transform from="´O" to="Ó"/>
		<transform from="´s" to="ś"/>
		<transform from="´S" to="Ś"/>
		<transform from="´z" to="ź"/>
		<transform from="´Z" to="Ź"/>
		<transform from="¨ " to="¨"/>
		<transform from="¨a" to="ä"/>
		<transform from="¨A" to="Ä"/>
		<transform from="¨o" to="ö"/>
		<transform from="¨O" to="Ö"/>
		<transform from="¨u" to="ü"/>
		<transform from="¨U" to="Ü"/>
		<transform from="° " to="°"/>
		<transform from="°a" to="å"/>
		<transform from="°A" to="Å"/>
		<transform from="°e" to="ė"/>
		<transform from="°E" to="Ė"/>
		<transform from="°g" to="ġ"/>
		<transform from="°z" to="ż"/>
		<transform from="°Z" to="Ż"/>
		<transform from="~ " to="~"/>
		<transform from="~o" to="õ"/>
		<transform from="~O" to="Õ"/>
	</transforms>
</keyboard>
